<?xml version="1.0" encoding="UTF-8"?>
<!DOCTYPE options SYSTEM "../bishbosh.dtd">	<!-- CAVEAT: amend after relocating this file ! -->
<!--
	AUTHOR: Dr. Alistair Ward

	Copyright (C) 2018 Dr. Alistair Ward

	This file is part of BishBosh.

	BishBosh is free software: you can redistribute it and/or modify
	it under the terms of the GNU General Public License as published by
	the Free Software Foundation, either version 3 of the License, or
	(at your option) any later version.

	BishBosh is distributed in the hope that it will be useful,
	but WITHOUT ANY WARRANTY; without even the implied warranty of
	MERCHANTABILITY or FITNESS FOR A PARTICULAR PURPOSE.  See the
	GNU General Public License for more details.

	You should have received a copy of the GNU General Public License
	along with BishBosh.  If not, see <http://www.gnu.org/licenses/>.
-->
<options>
	<evaluationOptions>
		&rankValues_Kaufman;
		&criteriaWeights;
		&pieceSquareTables_symmetric;
	</evaluationOptions>
	<searchOptions captureMoveSortAlgorithm="MVVLVA" retireKillerMovesAfter="3" sortOnStandardOpeningMoveFrequency="True" usePondering="True">
		&transpositions;
		&standardOpeningOptions;
		<searchDepthByLogicalColour>
			<byLogicalColour logicalColour="Black" searchDepth="5"/>
		</searchDepthByLogicalColour>
	</searchOptions>
	<ioOptions maximumPGNNames="8">
		&pgnOptions_SCID;
		<persistence filePath="/dev/null" automatic="False"/>	<!-- replace *nix-specific path with 'nul' in Windows ? -->
		<uiOptions moveNotation="PureCoordinate" verbosity="Silent">
			<cecpOptions/>
		</uiOptions>
	</ioOptions>
</options>
